{
 "schemaVersion": 1,
 "sandboxVersion": "1.1.0",
 "slug": "confucius",
 "sha256": "ce4eb3ba661788047e9edddbac28c4040067bd5210b76e85a0656e14d82eaf2c",
 "addonId": "confucius@zotero.plugin",
 "zotero": "10.0.3",
 "testedAt": "2026-09-27T09:22:09Z",
 "seconds": 188,
 "verdict": "as-described",
 "loaded": true,
 "cutShort": false,
 "exercised": {
  "itemsSelected": 3,
  "readerOpened": true,
  "settingsPane": true,
  "menuItems": 6,
  "dialogs": 0
 },
 "contacted": [
  "api.github.com"
 ],
 "hostUsage": {
  "api.github.com": {
   "usage": "sends-data",
   "sent": []
  }
 },
 "requests": [
  {
   "method": "GET",
   "host": "api.github.com",
   "path": "/repos/ZionDoki/confucius/releases"
  }
 ],
 "refused": [],
 "programs": [],
 "servers": [],
 "settings": [],
 "files": [],
 "databaseStructureChanged": false,
 "unexpected": []
}
