{
 "schemaVersion": 1,
 "sandboxVersion": "1.1.0",
 "slug": "zotero-agent-mcp",
 "sha256": "971d179023f0f53234e71ec7614df08ac8b9ee7bef9ffbe69bbfde6c20efecf2",
 "addonId": "zotero-agent-mcp@yjy.dev",
 "zotero": "10.0.3",
 "testedAt": "2026-09-27T06:54:52Z",
 "seconds": 83,
 "verdict": "as-described",
 "loaded": true,
 "cutShort": false,
 "exercised": {
  "itemsSelected": 3,
  "readerOpened": true,
  "settingsPane": true,
  "menuItems": 0,
  "dialogs": 0
 },
 "contacted": [],
 "hostUsage": {},
 "requests": [],
 "refused": [],
 "programs": [],
 "servers": [],
 "settings": [],
 "files": [],
 "databaseStructureChanged": false,
 "unexpected": []
}
