{
 "schemaVersion": 1,
 "sandboxVersion": "1.1.0",
 "slug": "citepulse",
 "sha256": "bb3e8f21cde3403ecbf31ca75ad150f49abe78698230480ef75f41aca16f97d5",
 "addonId": "citepulse@lilynaux",
 "zotero": "10.0.3",
 "testedAt": "2026-09-27T06:33:02Z",
 "seconds": 119,
 "verdict": "as-described",
 "loaded": true,
 "cutShort": false,
 "exercised": {
  "itemsSelected": 3,
  "readerOpened": true,
  "settingsPane": false,
  "menuItems": 2,
  "dialogs": 1
 },
 "contacted": [
  "api.openalex.org"
 ],
 "hostUsage": {
  "api.openalex.org": {
   "usage": "sends-library-data",
   "sent": [
    "identifiers"
   ]
  }
 },
 "requests": [
  {
   "method": "GET",
   "host": "api.openalex.org",
   "path": "/works/https://doi.org/10.1038%2Fnature14539"
  }
 ],
 "refused": [],
 "programs": [],
 "servers": [],
 "settings": [],
 "files": [],
 "databaseStructureChanged": false,
 "unexpected": []
}
