{
 "schemaVersion": 1,
 "sandboxVersion": "1.1.0",
 "slug": "zotero-rsvp",
 "sha256": "ebdcaafe16dc71bc3960ca4d1cca47eb29774ed124f5587b691ad68eb8b5277c",
 "addonId": "zotero-rsvp@local",
 "zotero": "9.0.6",
 "testedAt": "2026-09-27T05:41:26Z",
 "seconds": 83,
 "verdict": "as-described",
 "loaded": true,
 "cutShort": false,
 "exercised": {
  "itemsSelected": 3,
  "readerOpened": true,
  "settingsPane": false,
  "menuItems": 0,
  "dialogs": 0
 },
 "contacted": [],
 "hostUsage": {},
 "requests": [],
 "refused": [],
 "programs": [],
 "servers": [],
 "settings": [],
 "files": [],
 "databaseStructureChanged": false,
 "unexpected": []
}
