{
 "schemaVersion": 1,
 "sandboxVersion": "1.1.0",
 "slug": "jadense-in-zotero",
 "sha256": "28eee02c2e4673dc584b6bda2f74b33d4d991c4ff96c279046d7ce9d7e437790",
 "addonId": "jadense-in-zotero@jadense.cn",
 "zotero": "10.0.3",
 "testedAt": "2026-09-27T08:12:03Z",
 "seconds": 190,
 "verdict": "as-described",
 "loaded": true,
 "cutShort": false,
 "exercised": {
  "itemsSelected": 3,
  "readerOpened": true,
  "settingsPane": true,
  "menuItems": 6,
  "dialogs": 0
 },
 "contacted": [
  "api.github.com"
 ],
 "hostUsage": {
  "api.github.com": {
   "usage": "fetches",
   "sent": []
  }
 },
 "requests": [
  {
   "method": "GET",
   "host": "api.github.com",
   "path": "/repos/jadense-ai/jadense-in-zotero/releases/latest"
  }
 ],
 "refused": [],
 "programs": [],
 "servers": [],
 "settings": [],
 "files": [],
 "databaseStructureChanged": false,
 "unexpected": []
}
