{
 "schemaVersion": 1,
 "sandboxVersion": "1.1.0",
 "slug": "zotdupe",
 "sha256": "9ba9005f61e5493793463860913bf7083e8e73cc565b728dceb471ab88201737",
 "addonId": "zotdupe@hostiuc.com",
 "zotero": "9.0.6",
 "testedAt": "2026-09-27T07:40:43Z",
 "seconds": 100,
 "verdict": "as-described",
 "loaded": true,
 "cutShort": false,
 "exercised": {
  "itemsSelected": 3,
  "readerOpened": true,
  "settingsPane": true,
  "menuItems": 1,
  "dialogs": 1
 },
 "contacted": [],
 "hostUsage": {},
 "requests": [],
 "refused": [],
 "programs": [],
 "servers": [],
 "settings": [],
 "files": [],
 "databaseStructureChanged": false,
 "unexpected": []
}
