{
 "schemaVersion": 1,
 "sandboxVersion": "1.1.0",
 "slug": "paperloop",
 "sha256": "a6719dbf5994d754da5f9ba5a3b99c0b8681ed6292555bcda04b7b8c284e110d",
 "addonId": "paperloop-doi-bridge@paperloop.app",
 "zotero": "9.0.6",
 "testedAt": "2026-09-27T07:19:03Z",
 "seconds": 83,
 "verdict": "as-described",
 "loaded": true,
 "cutShort": false,
 "exercised": {
  "itemsSelected": 3,
  "readerOpened": true,
  "settingsPane": false,
  "menuItems": 0,
  "dialogs": 0
 },
 "contacted": [],
 "hostUsage": {},
 "requests": [],
 "refused": [],
 "programs": [],
 "servers": [],
 "settings": [],
 "files": [],
 "databaseStructureChanged": false,
 "unexpected": []
}
