{
 "schemaVersion": 1,
 "sandboxVersion": "1.1.0",
 "slug": "zotero-citation",
 "sha256": "23551690e40ad5ea85a10920d3f412707d405deabc23a171d294d1b993b67868",
 "addonId": "zoterocitation@polygon.org",
 "zotero": "10.0.3",
 "testedAt": "2026-09-27T08:29:13Z",
 "seconds": 100,
 "verdict": "as-described",
 "loaded": true,
 "cutShort": false,
 "exercised": {
  "itemsSelected": 3,
  "readerOpened": true,
  "settingsPane": false,
  "menuItems": 1,
  "dialogs": 0
 },
 "contacted": [],
 "hostUsage": {},
 "requests": [],
 "refused": [],
 "programs": [],
 "servers": [],
 "settings": [],
 "files": [],
 "databaseStructureChanged": false,
 "unexpected": []
}
