{
 "schemaVersion": 1,
 "sandboxVersion": "1.1.0",
 "slug": "zotero-doi-column",
 "sha256": "1105cbf9fe1b61bc0ce96f1b875b7a267d0b6b2745b4b5b5bb9bec0023c5c1b7",
 "addonId": "doi-column@anfang886.github.io",
 "zotero": "10.0.3",
 "testedAt": "2026-09-27T05:22:27Z",
 "seconds": 100,
 "verdict": "as-described",
 "loaded": true,
 "cutShort": false,
 "exercised": {
  "itemsSelected": 3,
  "readerOpened": true,
  "settingsPane": false,
  "menuItems": 1,
  "dialogs": 0
 },
 "contacted": [],
 "hostUsage": {},
 "requests": [],
 "refused": [],
 "programs": [],
 "servers": [],
 "settings": [],
 "files": [],
 "databaseStructureChanged": false,
 "unexpected": []
}
