{
 "schemaVersion": 1,
 "sandboxVersion": "1.1.0",
 "slug": "zofiles",
 "sha256": "14b468ccb6bc3200f7a79aea9c7f554322c66be20b6d3337d9adbccbf4af090f",
 "addonId": "zofiles@zofiles.dev",
 "zotero": "9.0.6",
 "testedAt": "2026-09-27T09:08:07Z",
 "seconds": 84,
 "verdict": "as-described",
 "loaded": true,
 "cutShort": false,
 "exercised": {
  "itemsSelected": 3,
  "readerOpened": true,
  "settingsPane": true,
  "menuItems": 0,
  "dialogs": 0
 },
 "contacted": [],
 "hostUsage": {},
 "requests": [],
 "refused": [],
 "programs": [],
 "servers": [],
 "settings": [],
 "files": [],
 "databaseStructureChanged": false,
 "unexpected": []
}
