{
 "schemaVersion": 1,
 "sandboxVersion": "1.1.0",
 "slug": "pp2zotero",
 "sha256": "e80cc1868a019e5f7b67883cf74227a984f94409f6342fd5ee9ffb59d1651b70",
 "addonId": "pp2zotero@hostiuc.com",
 "zotero": "9.0.6",
 "testedAt": "2026-09-27T10:53:08Z",
 "seconds": 100,
 "verdict": "as-described",
 "loaded": true,
 "cutShort": false,
 "exercised": {
  "itemsSelected": 3,
  "readerOpened": true,
  "settingsPane": false,
  "menuItems": 1,
  "dialogs": 1
 },
 "contacted": [],
 "hostUsage": {},
 "requests": [],
 "refused": [],
 "programs": [],
 "servers": [],
 "settings": [],
 "files": [],
 "databaseStructureChanged": false,
 "unexpected": []
}
