{
 "schemaVersion": 1,
 "sandboxVersion": "1.1.0",
 "slug": "lexinote",
 "sha256": "a7c501d52c53871abf47c3710d296b35f91da67ba61bfed8eded85de588dbc12",
 "addonId": "lexinote@local.tools",
 "zotero": "10.0.3",
 "testedAt": "2026-09-27T06:07:45Z",
 "seconds": 83,
 "verdict": "as-described",
 "loaded": true,
 "cutShort": false,
 "exercised": {
  "itemsSelected": 3,
  "readerOpened": true,
  "settingsPane": true,
  "menuItems": 0,
  "dialogs": 0
 },
 "contacted": [],
 "hostUsage": {},
 "requests": [],
 "refused": [],
 "programs": [],
 "servers": [],
 "settings": [],
 "files": [],
 "databaseStructureChanged": false,
 "unexpected": []
}
