{
 "schemaVersion": 1,
 "sandboxVersion": "1.1.0",
 "slug": "zotero-agent--auince",
 "sha256": "1605abc34d293f05e252f06596af2f1a2d9f970560d7d550e10c5cd8c4f69ab0",
 "addonId": "research-agent@zotero.example.com",
 "zotero": "10.0.3",
 "testedAt": "2026-09-27T10:02:08Z",
 "seconds": 83,
 "verdict": "as-described",
 "loaded": true,
 "cutShort": false,
 "exercised": {
  "itemsSelected": 3,
  "readerOpened": true,
  "settingsPane": true,
  "menuItems": 0,
  "dialogs": 0
 },
 "contacted": [],
 "hostUsage": {},
 "requests": [],
 "refused": [],
 "programs": [],
 "servers": [],
 "settings": [],
 "files": [],
 "databaseStructureChanged": false,
 "unexpected": []
}
