{
 "schemaVersion": 1,
 "sandboxVersion": "1.1.0",
 "slug": "aidea-zotero",
 "sha256": "43567682b242f7e2283bf26cd5d73d74cf07ee3f90fae3e626cdaab3c263d316",
 "addonId": "aidea@visterainer",
 "zotero": "10.0.3",
 "testedAt": "2026-09-27T08:11:22Z",
 "seconds": 83,
 "verdict": "as-described",
 "loaded": true,
 "cutShort": false,
 "exercised": {
  "itemsSelected": 3,
  "readerOpened": true,
  "settingsPane": true,
  "menuItems": 0,
  "dialogs": 0
 },
 "contacted": [],
 "hostUsage": {},
 "requests": [],
 "refused": [],
 "programs": [],
 "servers": [],
 "settings": [],
 "files": [],
 "databaseStructureChanged": true,
 "unexpected": []
}
