{
 "schemaVersion": 1,
 "sandboxVersion": "1.1.0",
 "slug": "zotero-ainote",
 "sha256": "9ebc0562f0e968e04f6930ee73d603c59c8039e08ba43855081a5a4eaa21a1b7",
 "addonId": "ainote@zotero.org",
 "zotero": "10.0.3",
 "testedAt": "2026-09-27T08:48:16Z",
 "seconds": 242,
 "verdict": "as-described",
 "loaded": true,
 "cutShort": false,
 "exercised": {
  "itemsSelected": 3,
  "readerOpened": true,
  "settingsPane": true,
  "menuItems": 9,
  "dialogs": 0
 },
 "contacted": [],
 "hostUsage": {},
 "requests": [],
 "refused": [],
 "programs": [],
 "servers": [
  "tcp 127.0.0.1:23123"
 ],
 "settings": [],
 "files": [],
 "databaseStructureChanged": false,
 "unexpected": []
}
