{
 "schemaVersion": 1,
 "sandboxVersion": "1.1.0",
 "slug": "zotero-citation-graph",
 "sha256": "c17ab186d26d4294b92bce29e11ef2bb27f2230117f7e961d75ebf2e96a05d01",
 "addonId": "zotero-citation-graph@jajaho.dev",
 "zotero": "10.0.3",
 "testedAt": "2026-09-27T06:18:12Z",
 "seconds": 83,
 "verdict": "as-described",
 "loaded": true,
 "cutShort": false,
 "exercised": {
  "itemsSelected": 3,
  "readerOpened": true,
  "settingsPane": true,
  "menuItems": 0,
  "dialogs": 0
 },
 "contacted": [],
 "hostUsage": {},
 "requests": [],
 "refused": [],
 "programs": [],
 "servers": [],
 "settings": [],
 "files": [],
 "databaseStructureChanged": false,
 "unexpected": []
}
