{
 "schemaVersion": 1,
 "sandboxVersion": "1.1.0",
 "slug": "zotero-hover-translate-eudic",
 "sha256": "52792e0b5cb8b51287fb8e3c81d6f5b0394cad1e0acd04ee3cac7029532e0375",
 "addonId": "hover-translate-eudic@zotero-plugins.dev",
 "zotero": "10.0.3",
 "testedAt": "2026-09-27T08:54:44Z",
 "seconds": 85,
 "verdict": "as-described",
 "loaded": true,
 "cutShort": false,
 "exercised": {
  "itemsSelected": 3,
  "readerOpened": true,
  "settingsPane": true,
  "menuItems": 0,
  "dialogs": 0
 },
 "contacted": [],
 "hostUsage": {},
 "requests": [],
 "refused": [],
 "programs": [],
 "servers": [],
 "settings": [],
 "files": [],
 "databaseStructureChanged": false,
 "unexpected": []
}
