{
 "schemaVersion": 1,
 "sandboxVersion": "1.1.0",
 "slug": "zotero-pdf-translate--reginalluna",
 "sha256": "f2eee764ab398bd87f9c74db25ab6fbe85bd5007a0d57573190cb176d808c6e8",
 "addonId": "zoteropdftranslate@euclpts.com",
 "zotero": "10.0.3",
 "testedAt": "2026-09-27T11:05:06Z",
 "seconds": 153,
 "verdict": "as-described",
 "loaded": true,
 "cutShort": false,
 "exercised": {
  "itemsSelected": 3,
  "readerOpened": true,
  "settingsPane": true,
  "menuItems": 4,
  "dialogs": 0
 },
 "contacted": [],
 "hostUsage": {},
 "requests": [],
 "refused": [],
 "programs": [],
 "servers": [],
 "settings": [],
 "files": [],
 "databaseStructureChanged": false,
 "unexpected": []
}
