{
 "schemaVersion": 1,
 "sandboxVersion": "1.1.0",
 "slug": "zotero-orbit",
 "sha256": "162c2eb806131694eed8884fa47682f790abbb83d0d1620336828cd0f7247be4",
 "addonId": "orbit@fkallmer.dev",
 "zotero": "10.0.3",
 "testedAt": "2026-09-27T10:23:15Z",
 "seconds": 189,
 "verdict": "as-described",
 "loaded": true,
 "cutShort": false,
 "exercised": {
  "itemsSelected": 3,
  "readerOpened": true,
  "settingsPane": true,
  "menuItems": 6,
  "dialogs": 0
 },
 "contacted": [
  "api.crossref.org",
  "api.openalex.org",
  "api.semanticscholar.org"
 ],
 "hostUsage": {
  "api.crossref.org": {
   "usage": "sends-library-data",
   "sent": [
    "identifiers"
   ]
  },
  "api.semanticscholar.org": {
   "usage": "sends-library-data",
   "sent": [
    "identifiers"
   ]
  },
  "api.openalex.org": {
   "usage": "sends-library-data",
   "sent": [
    "identifiers"
   ]
  }
 },
 "requests": [
  {
   "method": "GET",
   "host": "api.crossref.org",
   "path": "/works/10.1038/nature14539/transform/application/vnd.citationstyles.csl+json"
  },
  {
   "method": "GET",
   "host": "api.semanticscholar.org",
   "path": "/graph/v1/paper/DOI:10.1038/nature14539"
  },
  {
   "method": "GET",
   "host": "api.openalex.org",
   "path": "/works/doi:10.1038/nature14539"
  },
  {
   "method": "GET",
   "host": "api.openalex.org",
   "path": "/sources/S137773608"
  },
  {
   "method": "GET",
   "host": "api.openalex.org",
   "path": "/works"
  }
 ],
 "refused": [],
 "programs": [],
 "servers": [],
 "settings": [],
 "files": [],
 "databaseStructureChanged": false,
 "unexpected": []
}
