{
 "schemaVersion": 1,
 "sandboxVersion": "1.1.0",
 "slug": "zotero-author-search--ustc-iontrap",
 "sha256": "fc24f00af232c5fe7efe39a18ede1d9b80b66e94db6dc0929477bb45b7cc9bbe",
 "addonId": "authorsearch@euclpts.com",
 "zotero": "9.0.6",
 "testedAt": "2026-09-27T10:10:47Z",
 "seconds": 136,
 "verdict": "as-described",
 "loaded": true,
 "cutShort": false,
 "exercised": {
  "itemsSelected": 3,
  "readerOpened": true,
  "settingsPane": false,
  "menuItems": 3,
  "dialogs": 3
 },
 "contacted": [],
 "hostUsage": {},
 "requests": [],
 "refused": [],
 "programs": [],
 "servers": [],
 "settings": [],
 "files": [],
 "databaseStructureChanged": false,
 "unexpected": []
}
