{
 "schemaVersion": 1,
 "sandboxVersion": "1.1.0",
 "slug": "zotero-semantic-search",
 "sha256": "caec036e75cfd7d5af07033416bfdfabb99b6d406402e37f2f37535aa83fb175",
 "addonId": "semantic-search@ildon.github.io",
 "zotero": "10.0.3",
 "testedAt": "2026-09-27T09:58:12Z",
 "seconds": 101,
 "verdict": "as-described",
 "loaded": true,
 "cutShort": false,
 "exercised": {
  "itemsSelected": 3,
  "readerOpened": true,
  "settingsPane": true,
  "menuItems": 1,
  "dialogs": 0
 },
 "contacted": [],
 "hostUsage": {},
 "requests": [],
 "refused": [],
 "programs": [],
 "servers": [],
 "settings": [],
 "files": [],
 "databaseStructureChanged": false,
 "unexpected": []
}
