{
 "schemaVersion": 1,
 "sandboxVersion": "1.1.0",
 "slug": "zotero-chatgpt-sidebar",
 "sha256": "8834a7b867b39f80cf78929afa7df6a043f472cc7286b244ca2ff1fb894926e7",
 "addonId": "chatgpt-sidebar@zotero.local",
 "zotero": "10.0.3",
 "testedAt": "2026-09-27T07:42:15Z",
 "seconds": 82,
 "verdict": "as-described",
 "loaded": true,
 "cutShort": false,
 "exercised": {
  "itemsSelected": 3,
  "readerOpened": true,
  "settingsPane": false,
  "menuItems": 0,
  "dialogs": 0
 },
 "contacted": [],
 "hostUsage": {},
 "requests": [],
 "refused": [],
 "programs": [],
 "servers": [],
 "settings": [],
 "files": [],
 "databaseStructureChanged": false,
 "unexpected": []
}
