{
 "schemaVersion": 1,
 "sandboxVersion": "1.1.0",
 "slug": "rhapsode",
 "sha256": "d9031004efc7eeb25d6b96a844f322ec81293d272ff04bdd726c0feeccb6885c",
 "addonId": "rhapsode@saimai.lau",
 "zotero": "10.0.3",
 "testedAt": "2026-09-27T10:27:59Z",
 "seconds": 119,
 "verdict": "as-described",
 "loaded": true,
 "cutShort": false,
 "exercised": {
  "itemsSelected": 3,
  "readerOpened": true,
  "settingsPane": true,
  "menuItems": 2,
  "dialogs": 2
 },
 "contacted": [],
 "hostUsage": {},
 "requests": [],
 "refused": [],
 "programs": [],
 "servers": [],
 "settings": [],
 "files": [],
 "databaseStructureChanged": false,
 "unexpected": []
}
