{
 "schemaVersion": 1,
 "sandboxVersion": "1.1.0",
 "slug": "zotero-annotation-finder",
 "sha256": "2c81433f5c665a5d727ceb14bda55678d36355324bf7f0a24620ed387478ccb9",
 "addonId": "annotation-finder@christianweihsbach.com",
 "zotero": "9.0.6",
 "testedAt": "2026-09-27T07:04:40Z",
 "seconds": 99,
 "verdict": "as-described",
 "loaded": true,
 "cutShort": false,
 "exercised": {
  "itemsSelected": 3,
  "readerOpened": true,
  "settingsPane": false,
  "menuItems": 1,
  "dialogs": 0
 },
 "contacted": [],
 "hostUsage": {},
 "requests": [],
 "refused": [],
 "programs": [],
 "servers": [],
 "settings": [],
 "files": [],
 "databaseStructureChanged": false,
 "unexpected": []
}
